{
  "IZHKPC1jZ1MQGJ0iaSGUTWGjIYC2": {
    "0TTgGGLVqxghw9lmaoxG": {
      "id": "0TTgGGLVqxghw9lmaoxG",
      "date": "2024-10-02",
      "from": "Amazon ",
      "uid": "IZHKPC1jZ1MQGJ0iaSGUTWGjIYC2",
      "note": "",
      "amount": 154.35,
      "time": "10/13/2024"
    },
    "0aplBZt55xUo7EkR87C4": {
      "id": "0aplBZt55xUo7EkR87C4",
      "time": "11/14/2024",
      "from": "Fix N Fly",
      "date": "2024-11-13",
      "note": "",
      "uid": "IZHKPC1jZ1MQGJ0iaSGUTWGjIYC2",
      "amount": 551.76
    },
    "24mt9DmnGUQXWiz6Uy1B": {
      "id": "24mt9DmnGUQXWiz6Uy1B",
      "amount": 1402.55,
      "note": "",
      "from": "Fix N Fly",
      "uid": "IZHKPC1jZ1MQGJ0iaSGUTWGjIYC2",
      "time": "11/4/2024",
      "date": "2024-10-31"
    },
    "2xInCaBbb3tZCdIJc9ud": {
      "id": "2xInCaBbb3tZCdIJc9ud",
      "from": "Fami",
      "note": "",
      "time": "1/27/2025",
      "amount": 807,
      "uid": "IZHKPC1jZ1MQGJ0iaSGUTWGjIYC2",
      "date": "2025-01-27"
    },
    "3Q7EJi1JkBaweWHSktzg": {
      "id": "3Q7EJi1JkBaweWHSktzg",
      "uid": "IZHKPC1jZ1MQGJ0iaSGUTWGjIYC2",
      "time": "4/16/2025",
      "note": "",
      "from": "Fix N Fly",
      "amount": 1523.53,
      "date": "2025-04-17"
    },
    "5JFSBGC9dxYrFc5kkftN": {
      "id": "5JFSBGC9dxYrFc5kkftN",
      "time": "1/13/2025",
      "note": "Isaiah",
      "date": "2025-01-06",
      "amount": 50,
      "from": "Regalo de Cumpleaños",
      "uid": "IZHKPC1jZ1MQGJ0iaSGUTWGjIYC2"
    },
    "5fORuIBNVrINiACzxP6E": {
      "id": "5fORuIBNVrINiACzxP6E",
      "uid": "IZHKPC1jZ1MQGJ0iaSGUTWGjIYC2",
      "amount": 807.3,
      "time": "11/12/2024",
      "note": "",
      "from": "Fami",
      "date": "2024-11-12"
    },
    "6GplCSXLSxITiA9gNnci": {
      "id": "6GplCSXLSxITiA9gNnci",
      "date": "2024-12-02",
      "amount": 807.02,
      "note": "",
      "from": "Fami",
      "time": "12/9/2024",
      "uid": "IZHKPC1jZ1MQGJ0iaSGUTWGjIYC2"
    },
    "7o9vpii0w21XxwjI2fCu": {
      "id": "7o9vpii0w21XxwjI2fCu",
      "time": "3/27/2025",
      "date": "2025-03-27",
      "amount": 3583,
      "uid": "IZHKPC1jZ1MQGJ0iaSGUTWGjIYC2",
      "from": "Tax returns ",
      "note": ""
    },
    "8DEVsQmbLDTvuLGWhPsm": {
      "id": "8DEVsQmbLDTvuLGWhPsm",
      "time": "10/20/2024",
      "note": "",
      "from": "Tips ",
      "uid": "IZHKPC1jZ1MQGJ0iaSGUTWGjIYC2",
      "amount": 11,
      "date": "2024-10-19"
    },
    "8QvmTfsd3XjsAzV67QWJ": {
      "id": "8QvmTfsd3XjsAzV67QWJ",
      "uid": "IZHKPC1jZ1MQGJ0iaSGUTWGjIYC2",
      "time": "12/21/2024",
      "amount": 807.3,
      "date": "2024-12-16",
      "from": "Fami",
      "note": ""
    },
    "97nuuVFWxTDkkgkSPTvc": {
      "id": "97nuuVFWxTDkkgkSPTvc",
      "date": "2025-10-02",
      "time": "10/1/2025",
      "amount": 20,
      "from": "Testing Notes ",
      "note": "Testing notes 30",
      "uid": "IZHKPC1jZ1MQGJ0iaSGUTWGjIYC2"
    },
    "9Erhy2GpIN7qW9DUnVA9": {
      "id": "9Erhy2GpIN7qW9DUnVA9",
      "amount": 10,
      "date": "2025-03-11",
      "uid": "IZHKPC1jZ1MQGJ0iaSGUTWGjIYC2",
      "from": "Tips",
      "time": "3/11/2025",
      "note": "Cash"
    },
    "9Fpoj61eTBzkuXxQsqIl": {
      "id": "9Fpoj61eTBzkuXxQsqIl",
      "time": "2/27/2025",
      "date": "2025-02-27",
      "note": "Dice que es Depósito directo, pero no sé de que es ",
      "uid": "IZHKPC1jZ1MQGJ0iaSGUTWGjIYC2",
      "from": "United Airlines",
      "amount": 158.44
    },
    "BOpWOqZHtEABKWfJWUQS": {
      "id": "BOpWOqZHtEABKWfJWUQS",
      "note": "Dinero pendiente del depósito",
      "from": "Deibi",
      "uid": "IZHKPC1jZ1MQGJ0iaSGUTWGjIYC2",
      "time": "10/25/2024",
      "amount": 200,
      "date": "2024-10-25"
    },
    "Bwi9jfTOjwgGQn8zrLZs": {
      "id": "Bwi9jfTOjwgGQn8zrLZs",
      "note": "",
      "amount": 1343,
      "uid": "IZHKPC1jZ1MQGJ0iaSGUTWGjIYC2",
      "date": "2025-04-30",
      "time": "4/30/2025",
      "from": "Fix n fly"
    },
    "C4VDay63D0cY8CIe23Js": {
      "id": "C4VDay63D0cY8CIe23Js",
      "note": "",
      "date": "2025-09-24",
      "uid": "IZHKPC1jZ1MQGJ0iaSGUTWGjIYC2",
      "from": "Liseth",
      "time": "9/26/2025",
      "amount": 30
    },
    "CIRIOXGJhgUXm8csgYCQ": {
      "id": "CIRIOXGJhgUXm8csgYCQ",
      "uid": "IZHKPC1jZ1MQGJ0iaSGUTWGjIYC2",
      "date": "2025-01-13",
      "amount": 807.3,
      "note": "",
      "time": "1/13/2025",
      "from": "Fami"
    },
    "COnFW8HuGXwZL9z7BHVY": {
      "id": "COnFW8HuGXwZL9z7BHVY",
      "from": "test today income",
      "time": "9/11/2025",
      "note": "testing the income UI",
      "uid": "IZHKPC1jZ1MQGJ0iaSGUTWGjIYC2",
      "amount": 0.23,
      "date": "2025-09-12"
    },
    "FwQKs5CxYTWw2gHqMmrq": {
      "id": "FwQKs5CxYTWw2gHqMmrq",
      "date": "2024-12-30",
      "note": "",
      "time": "12/30/2024",
      "from": "Fami",
      "uid": "IZHKPC1jZ1MQGJ0iaSGUTWGjIYC2",
      "amount": 807
    },
    "Ga97ESeolMIRppRUW49v": {
      "id": "Ga97ESeolMIRppRUW49v",
      "time": "1/28/2025",
      "date": "2025-01-28",
      "amount": 0.01,
      "uid": "IZHKPC1jZ1MQGJ0iaSGUTWGjIYC2",
      "note": "Testting",
      "from": "Test"
    },
    "GfE0B4UR6MNAeAOnc3TW": {
      "id": "GfE0B4UR6MNAeAOnc3TW",
      "uid": "IZHKPC1jZ1MQGJ0iaSGUTWGjIYC2",
      "amount": 12.2,
      "date": "2025-01-29",
      "note": "",
      "from": "Macdonald",
      "time": "1/29/2025"
    },
    "GzyeUWqGPZrAoSa75CqA": {
      "id": "GzyeUWqGPZrAoSa75CqA",
      "date": "2025-03-12",
      "amount": 5,
      "from": "Tips",
      "time": "3/12/2025",
      "note": "",
      "uid": "IZHKPC1jZ1MQGJ0iaSGUTWGjIYC2"
    },
    "IYBWm826yVnjep6iJed1": {
      "id": "IYBWm826yVnjep6iJed1",
      "amount": 1382,
      "note": "",
      "date": "2025-05-15",
      "from": "Fix N Fly",
      "uid": "IZHKPC1jZ1MQGJ0iaSGUTWGjIYC2",
      "time": "5/19/2025"
    },
    "KwmZbFX17rzpCIjJqd0Z": {
      "id": "KwmZbFX17rzpCIjJqd0Z",
      "date": "2025-01-09",
      "time": "1/13/2025",
      "note": "",
      "from": "Rabinton Loan",
      "amount": 160,
      "uid": "IZHKPC1jZ1MQGJ0iaSGUTWGjIYC2"
    },
    "LzSJc1l30FwkrAUViddz": {
      "id": "LzSJc1l30FwkrAUViddz",
      "uid": "IZHKPC1jZ1MQGJ0iaSGUTWGjIYC2",
      "date": "2025-04-07",
      "amount": 5,
      "from": "Tips",
      "note": "",
      "time": "4/7/2025"
    },
    "Mb9eTldqhDmt3UDZFtt0": {
      "id": "Mb9eTldqhDmt3UDZFtt0",
      "time": "5/19/2025",
      "amount": 40,
      "date": "2025-05-05",
      "note": "",
      "uid": "IZHKPC1jZ1MQGJ0iaSGUTWGjIYC2",
      "from": "Liseth"
    },
    "MlqWnIrHxgp0fjYkKvva": {
      "id": "MlqWnIrHxgp0fjYkKvva",
      "from": "Venta Speaker ",
      "amount": 30,
      "uid": "IZHKPC1jZ1MQGJ0iaSGUTWGjIYC2",
      "date": "2024-10-25",
      "time": "10/25/2024",
      "note": ""
    },
    "QYRY7T0BMJktJ0GuqZue": {
      "id": "QYRY7T0BMJktJ0GuqZue",
      "from": "Fix N fly",
      "note": "Perdimos 280 de la repartición que no se pagó ",
      "amount": 1082.38,
      "uid": "IZHKPC1jZ1MQGJ0iaSGUTWGjIYC2",
      "time": "3/24/2025",
      "date": "2025-03-20"
    },
    "RYNMYRbgZ8N5DMjypJbj": {
      "id": "RYNMYRbgZ8N5DMjypJbj",
      "from": "Fami",
      "note": "",
      "amount": 807,
      "date": "2025-01-21",
      "uid": "IZHKPC1jZ1MQGJ0iaSGUTWGjIYC2",
      "time": "1/24/2025"
    },
    "TEMbohVtDiAbpCa380Q4": {
      "id": "TEMbohVtDiAbpCa380Q4",
      "date": "2025-03-24",
      "from": "Tips",
      "amount": 20,
      "time": "3/24/2025",
      "note": "",
      "uid": "IZHKPC1jZ1MQGJ0iaSGUTWGjIYC2"
    },
    "U0FjYqVj3lr15pbYvo0Y": {
      "id": "U0FjYqVj3lr15pbYvo0Y",
      "uid": "IZHKPC1jZ1MQGJ0iaSGUTWGjIYC2",
      "from": "Liseth",
      "time": "5/19/2025",
      "date": "2025-05-17",
      "amount": 70,
      "note": "Bowling "
    },
    "UKD6Gx13dGol5DGPEIw5": {
      "id": "UKD6Gx13dGol5DGPEIw5",
      "from": "EDS",
      "time": "9/26/2025",
      "date": "2025-09-24",
      "amount": 879.28,
      "note": "",
      "uid": "IZHKPC1jZ1MQGJ0iaSGUTWGjIYC2"
    },
    "UrcVV04hYwnMgRevjV56": {
      "id": "UrcVV04hYwnMgRevjV56",
      "date": "2025-03-06",
      "amount": 1349.59,
      "note": "",
      "time": "3/6/2025",
      "from": "Fix N Fly",
      "uid": "IZHKPC1jZ1MQGJ0iaSGUTWGjIYC2"
    },
    "VpfOXr27LbNpIB4TOKkp": {
      "id": "VpfOXr27LbNpIB4TOKkp",
      "time": "10/13/2024",
      "date": "2024-10-03",
      "note": "Pay check ",
      "amount": 1290.94,
      "uid": "IZHKPC1jZ1MQGJ0iaSGUTWGjIYC2",
      "from": "Fix N Fly "
    },
    "WpUW8ajR851tqt1hDhdx": {
      "id": "WpUW8ajR851tqt1hDhdx",
      "time": "2/18/2025",
      "uid": "IZHKPC1jZ1MQGJ0iaSGUTWGjIYC2",
      "from": "Fix N Fly",
      "amount": 708.82,
      "note": "",
      "date": "2025-02-06"
    },
    "X2sPb4vx3vmeqLRsc8t0": {
      "id": "X2sPb4vx3vmeqLRsc8t0",
      "from": "we have an error with the first day of the calculation",
      "amount": 502,
      "note": "we have to fix this bug",
      "time": "10/1/2025",
      "date": "2025-10-02",
      "uid": "IZHKPC1jZ1MQGJ0iaSGUTWGjIYC2"
    },
    "XDlfU3bACRiJq47Kvujz": {
      "id": "XDlfU3bACRiJq47Kvujz",
      "uid": "IZHKPC1jZ1MQGJ0iaSGUTWGjIYC2",
      "from": "Yosahara",
      "note": "Préstamo que le hice",
      "date": "2024-11-01",
      "time": "11/4/2024",
      "amount": 150
    },
    "XR8MY9o0c8vqBBVQeeuk": {
      "id": "XR8MY9o0c8vqBBVQeeuk",
      "date": "2025-09-18",
      "time": "9/11/2025",
      "uid": "IZHKPC1jZ1MQGJ0iaSGUTWGjIYC2",
      "amount": 0.2,
      "note": "Testing the income UI",
      "from": "test income"
    },
    "YDUPhTq8F8BW3RMirO1j": {
      "id": "YDUPhTq8F8BW3RMirO1j",
      "uid": "IZHKPC1jZ1MQGJ0iaSGUTWGjIYC2",
      "amount": 563.29,
      "time": "10/16/2024",
      "date": "2024-10-16",
      "from": "Amazon",
      "note": ""
    },
    "YYxVfRRMhI9Tz2uOB0Hl": {
      "id": "YYxVfRRMhI9Tz2uOB0Hl",
      "time": "11/14/2024",
      "from": "Rabinton",
      "amount": 50,
      "note": "Prestamo",
      "date": "2024-11-14",
      "uid": "IZHKPC1jZ1MQGJ0iaSGUTWGjIYC2"
    },
    "ZgdlPXrvz0lzEoaFptj7": {
      "id": "ZgdlPXrvz0lzEoaFptj7",
      "note": "Bono por referir a Katerine",
      "time": "3/24/2025",
      "date": "2025-03-21",
      "amount": 200,
      "from": "Fix N Fly",
      "uid": "IZHKPC1jZ1MQGJ0iaSGUTWGjIYC2"
    },
    "bqNLEhQoRBueASE2pOpj": {
      "id": "bqNLEhQoRBueASE2pOpj",
      "amount": 1302.95,
      "uid": "IZHKPC1jZ1MQGJ0iaSGUTWGjIYC2",
      "note": "",
      "time": "10/17/2024",
      "from": "Fix N Fly",
      "date": "2024-10-16"
    },
    "cRdSqEy8oTLJFBZ09660": {
      "id": "cRdSqEy8oTLJFBZ09660",
      "note": "",
      "time": "2/2/2025",
      "amount": 6.36,
      "date": "2025-02-02",
      "from": "Tips",
      "uid": "IZHKPC1jZ1MQGJ0iaSGUTWGjIYC2"
    },
    "dpv40IAeJgDS9qbPEWFr": {
      "id": "dpv40IAeJgDS9qbPEWFr",
      "date": "2025-02-06",
      "amount": 708.82,
      "note": "",
      "from": "Fix N’ Fly",
      "time": "2/6/2025",
      "uid": "IZHKPC1jZ1MQGJ0iaSGUTWGjIYC2"
    },
    "eYAKn24OqB6q3dMO2hQo": {
      "id": "eYAKn24OqB6q3dMO2hQo",
      "date": "2025-09-19",
      "amount": 142.33,
      "uid": "IZHKPC1jZ1MQGJ0iaSGUTWGjIYC2",
      "time": "9/26/2025",
      "from": "EDS",
      "note": "EDS"
    },
    "eixjnKfox9NE8lwgOSkM": {
      "id": "eixjnKfox9NE8lwgOSkM",
      "from": "Fami",
      "date": "2024-12-23",
      "amount": 807,
      "note": "",
      "uid": "IZHKPC1jZ1MQGJ0iaSGUTWGjIYC2",
      "time": "12/30/2024"
    },
    "esPGM8yxoHtqdfWUswYG": {
      "id": "esPGM8yxoHtqdfWUswYG",
      "note": "",
      "uid": "IZHKPC1jZ1MQGJ0iaSGUTWGjIYC2",
      "amount": 807.3,
      "time": "12/9/2024",
      "from": "Fami",
      "date": "2024-12-09"
    },
    "gGF2fbV7Z8tjcyAihaLq": {
      "id": "gGF2fbV7Z8tjcyAihaLq",
      "date": "2024-10-09",
      "amount": 129.35,
      "note": "",
      "from": "Amazon ",
      "time": "10/13/2024",
      "uid": "IZHKPC1jZ1MQGJ0iaSGUTWGjIYC2"
    },
    "h22WgRVwV8hJ9PHH6NXx": {
      "id": "h22WgRVwV8hJ9PHH6NXx",
      "amount": 1137.63,
      "from": "Fix N Fly",
      "time": "2/22/2025",
      "note": "",
      "uid": "IZHKPC1jZ1MQGJ0iaSGUTWGjIYC2",
      "date": "2025-02-20"
    },
    "hIHHwmHqAa8MiUBs587x": {
      "id": "hIHHwmHqAa8MiUBs587x",
      "from": "Fami",
      "time": "11/27/2024",
      "amount": 807.3,
      "date": "2024-11-25",
      "note": "",
      "uid": "IZHKPC1jZ1MQGJ0iaSGUTWGjIYC2"
    },
    "i3ZWLhZVGwZcy1fsFcAt": {
      "id": "i3ZWLhZVGwZcy1fsFcAt",
      "note": "rab made me buy it. said it helped me with my hair.",
      "uid": "IZHKPC1jZ1MQGJ0iaSGUTWGjIYC2",
      "date": "2024-10-13",
      "from": "Hair Growth ",
      "time": "10/16/2024",
      "amount": 10.48
    },
    "i83eqQ1GRo2Oq6yqGelG": {
      "id": "i83eqQ1GRo2Oq6yqGelG",
      "amount": 50,
      "time": "10/15/2025",
      "note": "",
      "from": "testing income last week",
      "uid": "IZHKPC1jZ1MQGJ0iaSGUTWGjIYC2",
      "date": "2025-10-08"
    },
    "i9wYELHd0er2W7QtFRcr": {
      "id": "i9wYELHd0er2W7QtFRcr",
      "amount": 2.5,
      "time": "2/22/2025",
      "date": "2025-02-22",
      "note": "",
      "uid": "IZHKPC1jZ1MQGJ0iaSGUTWGjIYC2",
      "from": "Tips"
    },
    "j1SE0qCsPUndHZXxwW10": {
      "id": "j1SE0qCsPUndHZXxwW10",
      "date": "2024-11-03",
      "time": "11/4/2024",
      "amount": 80,
      "from": "Isaiah Velez ",
      "uid": "IZHKPC1jZ1MQGJ0iaSGUTWGjIYC2",
      "note": "Medicinas & Macdonald "
    },
    "keV2RLV6d2uBqHqeoDoc": {
      "id": "keV2RLV6d2uBqHqeoDoc",
      "uid": "IZHKPC1jZ1MQGJ0iaSGUTWGjIYC2",
      "date": "2025-01-06",
      "time": "1/13/2025",
      "amount": 807.3,
      "from": "Fami",
      "note": ""
    },
    "l2LumATc0mpeYVOsj8zm": {
      "id": "l2LumATc0mpeYVOsj8zm",
      "date": "2025-03-26",
      "time": "3/27/2025",
      "from": "Tax returns ",
      "amount": 2800.2,
      "uid": "IZHKPC1jZ1MQGJ0iaSGUTWGjIYC2",
      "note": ""
    },
    "lKS7NmF3l0id0voG1GMz": {
      "id": "lKS7NmF3l0id0voG1GMz",
      "from": "Youtube",
      "note": "Testing Notes",
      "uid": "IZHKPC1jZ1MQGJ0iaSGUTWGjIYC2",
      "date": "2025-10-01",
      "amount": 500,
      "time": "10/1/2025"
    },
    "mKJapmKGKshArJgxP5p1": {
      "id": "mKJapmKGKshArJgxP5p1",
      "time": "10/23/2024",
      "from": "Amazon",
      "note": "",
      "amount": 393.45,
      "date": "2024-10-23",
      "uid": "IZHKPC1jZ1MQGJ0iaSGUTWGjIYC2"
    },
    "mpyjnoSLRLPORXYlFTQ4": {
      "id": "mpyjnoSLRLPORXYlFTQ4",
      "amount": 546.26,
      "note": "",
      "time": "9/26/2025",
      "uid": "IZHKPC1jZ1MQGJ0iaSGUTWGjIYC2",
      "date": "2025-09-25",
      "from": "Helzberg"
    },
    "oS5CIxHPOqcFoPraTNC7": {
      "id": "oS5CIxHPOqcFoPraTNC7",
      "time": "10/15/2025",
      "uid": "IZHKPC1jZ1MQGJ0iaSGUTWGjIYC2",
      "amount": 200,
      "date": "2025-10-15",
      "note": "",
      "from": "testing income"
    },
    "p7LnZkwTQrs8jTdAssSf": {
      "id": "p7LnZkwTQrs8jTdAssSf",
      "from": "Hair growth ",
      "note": "rab made me buy it. said it helped me with my hair.",
      "date": "2024-10-13",
      "amount": 10.4,
      "uid": "IZHKPC1jZ1MQGJ0iaSGUTWGjIYC2",
      "time": "10/16/2024"
    },
    "qWcbm7jOlAfFwMSXstnR": {
      "id": "qWcbm7jOlAfFwMSXstnR",
      "uid": "IZHKPC1jZ1MQGJ0iaSGUTWGjIYC2",
      "date": "2025-03-03",
      "note": "",
      "time": "3/3/2025",
      "from": "Tips",
      "amount": 5
    },
    "rxVuc8XM2ICGR1Va5SAW": {
      "id": "rxVuc8XM2ICGR1Va5SAW",
      "time": "4/4/2025",
      "note": "",
      "amount": 1513.3,
      "uid": "IZHKPC1jZ1MQGJ0iaSGUTWGjIYC2",
      "from": "Fix N Fly",
      "date": "2025-04-03"
    },
    "trvCEUKKdIXdqUw8irco": {
      "id": "trvCEUKKdIXdqUw8irco",
      "from": "Rabinton",
      "time": "11/4/2024",
      "uid": "IZHKPC1jZ1MQGJ0iaSGUTWGjIYC2",
      "note": "Cena con Rabinton",
      "date": "2024-10-31",
      "amount": 20
    },
    "ugOVbKLThdsF15QbwNPV": {
      "id": "ugOVbKLThdsF15QbwNPV",
      "note": "Testing, it’s not real amount ",
      "from": "Fix n fly",
      "date": "2024-10-15",
      "amount": 99,
      "uid": "IZHKPC1jZ1MQGJ0iaSGUTWGjIYC2",
      "time": "10/15/2024"
    },
    "v88mjEcIipyAemGmSFt8": {
      "id": "v88mjEcIipyAemGmSFt8",
      "uid": "IZHKPC1jZ1MQGJ0iaSGUTWGjIYC2",
      "time": "11/18/2024",
      "date": "2024-11-18",
      "from": "Fami",
      "amount": 807.3,
      "note": "Pago por trabajo Fix N Fly"
    },
    "vYxMZPibNciJEypWgexU": {
      "id": "vYxMZPibNciJEypWgexU",
      "uid": "IZHKPC1jZ1MQGJ0iaSGUTWGjIYC2",
      "date": "2024-12-02",
      "from": "Youtube",
      "time": "12/9/2024",
      "amount": 19.9,
      "note": ""
    },
    "yorhUieaG4R6w24RySnW": {
      "id": "yorhUieaG4R6w24RySnW",
      "uid": "IZHKPC1jZ1MQGJ0iaSGUTWGjIYC2",
      "from": "Canes",
      "note": "",
      "date": "2024-12-01",
      "amount": 48.34,
      "time": "12/9/2024"
    },
    "zvVXpy6mFk6kBGNlDgqC": {
      "id": "zvVXpy6mFk6kBGNlDgqC",
      "date": "2025-09-11",
      "uid": "IZHKPC1jZ1MQGJ0iaSGUTWGjIYC2",
      "from": "test today 11 income",
      "time": "9/11/2025",
      "amount": 20,
      "note": ""
    }
  },
  "P0C5Gfv2twNlQNZvQxXkdF0plXo1": {
    "0XyduIV0Q1PRXFgBVj0S": {
      "id": "0XyduIV0Q1PRXFgBVj0S",
      "time": "9/18/2025",
      "uid": "P0C5Gfv2twNlQNZvQxXkdF0plXo1",
      "note": "Pay check ",
      "date": "2025-09-02",
      "amount": 666,
      "from": "EDS"
    },
    "2MCiO8KbzxkZPc8JlfqD": {
      "id": "2MCiO8KbzxkZPc8JlfqD",
      "date": "2025-01-29",
      "uid": "P0C5Gfv2twNlQNZvQxXkdF0plXo1",
      "note": "Test",
      "time": "1/29/2025",
      "from": "Test",
      "amount": 0.01
    },
    "50ZuZ29EtWkMzj5Pxb2K": {
      "id": "50ZuZ29EtWkMzj5Pxb2K",
      "time": "7/27/2025",
      "from": "Préstamo sonia",
      "note": "Sonia te presto para cubrir las deudas ",
      "uid": "P0C5Gfv2twNlQNZvQxXkdF0plXo1",
      "date": "2025-07-25",
      "amount": 1000
    },
    "6BhEaTLTUAyMwHv2L0vU": {
      "id": "6BhEaTLTUAyMwHv2L0vU",
      "date": "2025-09-19",
      "uid": "P0C5Gfv2twNlQNZvQxXkdF0plXo1",
      "time": "9/19/2025",
      "note": "",
      "amount": 142.33,
      "from": "EDS"
    },
    "6KJZKy8lLr8FzGSb5hNl": {
      "id": "6KJZKy8lLr8FzGSb5hNl",
      "time": "8/24/2025",
      "note": "",
      "uid": "P0C5Gfv2twNlQNZvQxXkdF0plXo1",
      "amount": 20,
      "date": "2025-08-24",
      "from": "Apuesta con Yosahara"
    },
    "BNUwhYHVGGMpU2TLJBTE": {
      "id": "BNUwhYHVGGMpU2TLJBTE",
      "from": "EDS",
      "note": "",
      "time": "9/24/2025",
      "amount": 879.28,
      "date": "2025-09-24",
      "uid": "P0C5Gfv2twNlQNZvQxXkdF0plXo1"
    },
    "BXlJLNW4FGybcqxxCN9S": {
      "id": "BXlJLNW4FGybcqxxCN9S",
      "date": "2025-10-10",
      "note": "",
      "uid": "P0C5Gfv2twNlQNZvQxXkdF0plXo1",
      "from": "Helzberg Diamonds",
      "time": "10/10/2025",
      "amount": 1224.55
    },
    "EupSkZhgUyAUMbjug0H8": {
      "id": "EupSkZhgUyAUMbjug0H8",
      "amount": 21,
      "from": "Tip",
      "note": "",
      "date": "2025-07-21",
      "time": "7/21/2025",
      "uid": "P0C5Gfv2twNlQNZvQxXkdF0plXo1"
    },
    "Wtlk5ohQUK05ay5P2y1T": {
      "id": "Wtlk5ohQUK05ay5P2y1T",
      "note": "",
      "from": "Fix N Fly",
      "uid": "P0C5Gfv2twNlQNZvQxXkdF0plXo1",
      "time": "7/10/2025",
      "date": "2025-07-10",
      "amount": 1477.17
    },
    "ZkkyenGa368K5oBB7Rot": {
      "id": "ZkkyenGa368K5oBB7Rot",
      "from": "EDS",
      "uid": "P0C5Gfv2twNlQNZvQxXkdF0plXo1",
      "amount": 706.41,
      "note": "Pay check",
      "date": "2025-09-11",
      "time": "9/18/2025"
    },
    "asFJ0nYNxXvZqeQ3Oabd": {
      "id": "asFJ0nYNxXvZqeQ3Oabd",
      "from": "Zelle from Liseth",
      "date": "2025-09-16",
      "amount": 25,
      "note": "",
      "time": "9/18/2025",
      "uid": "P0C5Gfv2twNlQNZvQxXkdF0plXo1"
    },
    "ddTVyG1s5j1sR64zod2h": {
      "id": "ddTVyG1s5j1sR64zod2h",
      "note": "Zelle from Isaiah for error on electricity overcharge ",
      "uid": "P0C5Gfv2twNlQNZvQxXkdF0plXo1",
      "from": "Electricity ",
      "time": "10/7/2025",
      "amount": 75,
      "date": "2025-10-07"
    },
    "n19i0n6epgP7NE6XuCdb": {
      "id": "n19i0n6epgP7NE6XuCdb",
      "date": "2025-07-24",
      "amount": 1423.63,
      "from": "Fix N Fly",
      "time": "7/24/2025",
      "uid": "P0C5Gfv2twNlQNZvQxXkdF0plXo1",
      "note": ""
    },
    "xN7BJ5fvhciVutUEbejR": {
      "id": "xN7BJ5fvhciVutUEbejR",
      "date": "2025-09-25",
      "from": "Liseth ",
      "uid": "P0C5Gfv2twNlQNZvQxXkdF0plXo1",
      "note": "She want to pay the pizza ",
      "time": "9/25/2025",
      "amount": 30
    },
    "yhO2yKukRfKzWiGKk7Ed": {
      "id": "yhO2yKukRfKzWiGKk7Ed",
      "amount": 546.26,
      "uid": "P0C5Gfv2twNlQNZvQxXkdF0plXo1",
      "note": "",
      "from": "Helzberg Diamonds ",
      "date": "2025-09-25",
      "time": "9/25/2025"
    },
    "zSVyQd0RHUJ0yTEUzBpY": {
      "id": "zSVyQd0RHUJ0yTEUzBpY",
      "date": "2025-10-03",
      "note": "Bonuses",
      "uid": "P0C5Gfv2twNlQNZvQxXkdF0plXo1",
      "amount": 34.51,
      "from": "Helzberg Diamonds ",
      "time": "10/3/2025"
    }
  },
  "MwMUoxhAWiU7YJ8g8yupwA1kJly1": {
    "2ivGu3VYTC8bY3CWxpKw": {
      "id": "2ivGu3VYTC8bY3CWxpKw",
      "from": "Fix N Fly",
      "date": "2024-10-31",
      "note": "",
      "time": "11/1/2024",
      "uid": "MwMUoxhAWiU7YJ8g8yupwA1kJly1",
      "amount": 1906.1
    },
    "8V4G8UxDtIp5oHZwW3kw": {
      "id": "8V4G8UxDtIp5oHZwW3kw",
      "from": "Sale of Condominiums ",
      "note": "One time",
      "uid": "MwMUoxhAWiU7YJ8g8yupwA1kJly1",
      "amount": 7301,
      "date": "2025-10-24",
      "time": "10/24/2025"
    },
    "FxWGKY2GPr8lfxCK4ozI": {
      "id": "FxWGKY2GPr8lfxCK4ozI",
      "time": "10/24/2025",
      "from": "Unemployment",
      "note": "All payments from October plus lilahs portion of rent",
      "date": "2025-10-24",
      "amount": 2138,
      "uid": "MwMUoxhAWiU7YJ8g8yupwA1kJly1"
    }
  },
  "p109bjvt5mPBxtgT7DoqiBP6kXk1": {
    "9p9NfeeT597sGCZTydx6": {
      "id": "9p9NfeeT597sGCZTydx6",
      "time": "1/30/2025",
      "uid": "p109bjvt5mPBxtgT7DoqiBP6kXk1",
      "from": "Test 1",
      "amount": 20,
      "note": "this is the first Test",
      "date": "2025-01-30"
    },
    "F4HVCQZdM0KlxoiUP0nD": {
      "id": "F4HVCQZdM0KlxoiUP0nD",
      "date": "2025-01-26",
      "amount": 22.33,
      "from": "Test 4",
      "uid": "p109bjvt5mPBxtgT7DoqiBP6kXk1",
      "note": "this is the test 4",
      "time": "1/30/2025"
    },
    "VLazZVE4R5qJXQejcMmG": {
      "id": "VLazZVE4R5qJXQejcMmG",
      "note": "this is the thirt test",
      "from": "test 3",
      "uid": "p109bjvt5mPBxtgT7DoqiBP6kXk1",
      "time": "1/30/2025",
      "date": "2025-01-30",
      "amount": 99.223
    },
    "jN9bpskVZAMdRozDI2HN": {
      "id": "jN9bpskVZAMdRozDI2HN",
      "amount": 18.22,
      "date": "2025-01-26",
      "from": "Test 2 ",
      "time": "1/30/2025",
      "note": "this is the second test",
      "uid": "p109bjvt5mPBxtgT7DoqiBP6kXk1"
    }
  },
  "XzxEeKoj3sZrJhdEysjXzX7TRww1": {
    "AytcC6AoSA7JkueiUNTF": {
      "id": "AytcC6AoSA7JkueiUNTF",
      "uid": "XzxEeKoj3sZrJhdEysjXzX7TRww1",
      "amount": 1230.92,
      "time": "10/13/2024",
      "from": "Fix N Fly",
      "date": "2024-10-09",
      "note": "main job"
    },
    "f6cLoI6FxueDP2csEf3S": {
      "id": "f6cLoI6FxueDP2csEf3S",
      "note": "",
      "date": "2024-10-14",
      "time": "10/15/2024",
      "amount": 1280,
      "from": "Amazon",
      "uid": "XzxEeKoj3sZrJhdEysjXzX7TRww1"
    },
    "h4xlfizL2EA3Wf7g0gtQ": {
      "id": "h4xlfizL2EA3Wf7g0gtQ",
      "amount": 129.35,
      "note": "second pay check part time job",
      "uid": "XzxEeKoj3sZrJhdEysjXzX7TRww1",
      "from": "Amazon",
      "time": "10/13/2024",
      "date": "2024-10-09"
    },
    "k5HV8GlfdpyWkyDqP5W6": {
      "id": "k5HV8GlfdpyWkyDqP5W6",
      "time": "10/27/2024",
      "from": "Amazon",
      "amount": 99,
      "uid": "XzxEeKoj3sZrJhdEysjXzX7TRww1",
      "note": "Test Different Month",
      "date": "2024-07-24"
    },
    "ziTK6UT0LaJXFDjFbMn4": {
      "id": "ziTK6UT0LaJXFDjFbMn4",
      "uid": "XzxEeKoj3sZrJhdEysjXzX7TRww1",
      "amount": 154.35,
      "time": "10/13/2024",
      "from": "Amazon",
      "date": "2024-10-02",
      "note": "part time job | first pay Check"
    },
    "zjYj4PC0l1eVYGDnAL7F": {
      "id": "zjYj4PC0l1eVYGDnAL7F",
      "from": "Amazon",
      "amount": 123,
      "uid": "XzxEeKoj3sZrJhdEysjXzX7TRww1",
      "time": "10/18/2024",
      "date": "2024-10-24",
      "note": "Test 00"
    }
  }
}